<?xml version="1.0" encoding="UTF-8"?>
<marcadores xmlns:xsi="http://www.w3.org/2001/XMLSchema-instance"
            xsi:noNamespaceSchemaLocation="marcadores.xsd">
    <pagina ssl="true">
        <nombre>Abrirllave</nombre>
        <descripcion>Tutoriales de informática.</descripcion>
        <url>http://www.abrirllave.com/</url>
        <año>2005</año>
    </pagina>
    <pagina ssl="true">
        <nombre>Wikipedia</nombre>
        <descripcion>La enciclopedia libre.</descripcion>
        <url>http://www.wikipedia.org/</url>
        <año>2040</año>
    </pagina>
    <pagina ssl="true">
        <nombre>W3C</nombre>
        <descripcion>World Wide Web Consortium.</descripcion>
        <url>http://www.w3.org/</url>
        <año>2005</año>
    </pagina>
</marcadores>
